{
  "$schema": "https://json-schema.org/draft/2020-12/schema",
  "$id": "https://schemas.sistematech.local/esocial/v1/esocial-s-1298-sgp-request-dto-v1.schema.json",
  "title": "eSocial S-1298 SGP request DTO v1",
  "type": "object",
  "additionalProperties": false,
  "properties": {
    "eventClass": {
      "const": "S-1298"
    },
    "tenantId": {
      "type": "string",
      "minLength": 1
    },
    "sourceEventId": {
      "type": "string",
      "minLength": 1
    },
    "sourceEntityId": {
      "type": "string",
      "minLength": 1
    },
    "sourceEntityIds": {
      "type": "array",
      "items": {
        "type": "string",
        "minLength": 1
      }
    },
    "environment": {
      "enum": [
        "qualification",
        "restricted_production",
        "production"
      ]
    },
    "operation": {
      "enum": [
        "inclusion",
        "change",
        "rectification",
        "exclusion"
      ]
    },
    "employerCnpj": {
      "type": "string",
      "minLength": 1
    },
    "competence": {
      "type": "string",
      "minLength": 1
    },
    "acceptedClosureReceipt": {
      "type": "string",
      "minLength": 1
    },
    "acceptedClosureAt": {
      "type": "string",
      "minLength": 1
    },
    "eventId": {
      "type": "string",
      "minLength": 1
    }
  },
  "required": [
    "eventClass",
    "tenantId",
    "sourceEventId",
    "employerCnpj",
    "competence",
    "acceptedClosureReceipt",
    "acceptedClosureAt"
  ],
  "not": {
    "anyOf": [
      {
        "required": [
          "xml"
        ]
      },
      {
        "required": [
          "payloadXml"
        ]
      },
      {
        "required": [
          "signedXml"
        ]
      },
      {
        "required": [
          "signedEnvelope"
        ]
      },
      {
        "required": [
          "pkcs7"
        ]
      },
      {
        "required": [
          "pkcs7Sha256"
        ]
      }
    ]
  }
}
